sku,title,description,details,designer,mrsp,currencyId,prices,variants,optionTypes,defaultImages
0,Floral Amsterdam Dress,Softly tied cuffs add a sweet trend-right touch to this floral-print Reformation maxi.,"Black and red floral crepe (100% Viscose). Maxi. Crew neckline. Short sleeves with tie closure. Exposed back button keyhole closure. Invisible back zipper closure. 53.75"" from shoulder to hemline. Made in USA.",Reformation,218,USD,"{'3': 0, '5': 0, 'purchase': 0}","[{'id': 0, 'options': {'sizes': 'Sized: 0-12, one length available. Regular measures 53.75"" from shoulder to hemline.'}, 'images': ['https://pc-ap.rtrcdn.com/productimages/nomodel/183x/bd/REF2.jpg', 'https://pc-ap.rtrcdn.com/productimages/front/183x/bd/REF2.jpg', 'https://pc-ap.rtrcdn.com/productimages/back/183x/bd/REF2.jpg', 'https://pc-ap.rtrcdn.com/productimages/side/183x/bd/REF2.jpg'], 'inStock': True}]","[{'size': 'Sized: 0-12, one length available. Regular measures 53.75"" from shoulder to hemline.'}]","['https://pc-ap.rtrcdn.com/productimages/nomodel/183x/bd/REF2.jpg', 'https://pc-ap.rtrcdn.com/productimages/front/183x/bd/REF2.jpg', 'https://pc-ap.rtrcdn.com/productimages/back/183x/bd/REF2.jpg', 'https://pc-ap.rtrcdn.com/productimages/side/183x/bd/REF2.jpg']"
0,Wandering Vine Rebecca Dress,A solid bodice adds a trend-right update to this breezy Hutch dress finished with a fiesta-ready high-low skirt. Complete the look with the Large Lapis Hoop Earrings by Kenneth Jay Lane.,"Blue and white printed crepe (60% Rayon, 32% Nylon, 8% Spandex). Hourglass. Sleeveless. Crew neckline. Hidden side zipper with hook-and-eye closure. Partially lined. 41"" from shoulder to shortest hemline, 52"" from shoulder to longest hemline. Imported.",Hutch,280,USD,"{'3': 0, '5': 0, 'purchase': 0}","[{'id': 0, 'options': {'sizes': 'Sized: XS-3X, one length available. Regular measures 41"" from shoulder to shortest hemline, 52"" from shoulder to longest hemline.'}, 'images': ['https://pc-ap.rtrcdn.com/productimages/nomodel/183x/b1/HTC41.jpg', 'https://pc-ap.rtrcdn.com/productimages/front/183x/b1/HTC41.jpg', 'https://pc-ap.rtrcdn.com/productimages/back/183x/b1/HTC41.jpg', 'https://pc-ap.rtrcdn.com/productimages/front_plus/183x/b1/HTC41.jpg'], 'inStock': True}]","[{'size': 'Sized: XS-3X, one length available. Regular measures 41"" from shoulder to shortest hemline, 52"" from shoulder to longest hemline.'}]","['https://pc-ap.rtrcdn.com/productimages/nomodel/183x/b1/HTC41.jpg', 'https://pc-ap.rtrcdn.com/productimages/front/183x/b1/HTC41.jpg', 'https://pc-ap.rtrcdn.com/productimages/back/183x/b1/HTC41.jpg', 'https://pc-ap.rtrcdn.com/productimages/front_plus/183x/b1/HTC41.jpg']"
0,Caterine Dress,Painterly blooms further the feminine appeal of this light and airy chiffon dress from MISA Los Angeles.,"Black floral printed chiffon (100% Viscose). Hourglass. Sleeveless. V-neckline. Elastic waistband. 45.5"" from shoulder to hemline. Made in the USA.",MISA Los Angeles,343,USD,"{'3': 0, '5': 0, 'purchase': 0}","[{'id': 0, 'options': {'sizes': 'Sized: XS-XL, one length available. Regular measures 45.5"" from shoulder to hemline.'}, 'images': ['https://pc-ap.rtrcdn.com/productimages/nomodel/183x/da/MISA5.jpg', 'https://pc-ap.rtrcdn.com/productimages/front/183x/da/MISA5.jpg', 'https://pc-ap.rtrcdn.com/productimages/back/183x/da/MISA5.jpg', 'https://pc-ap.rtrcdn.com/productimages/side/183x/da/MISA5.jpg'], 'inStock': True}]","[{'size': 'Sized: XS-XL, one length available. Regular measures 45.5"" from shoulder to hemline.'}]","['https://pc-ap.rtrcdn.com/productimages/nomodel/183x/da/MISA5.jpg', 'https://pc-ap.rtrcdn.com/productimages/front/183x/da/MISA5.jpg', 'https://pc-ap.rtrcdn.com/productimages/back/183x/da/MISA5.jpg', 'https://pc-ap.rtrcdn.com/productimages/side/183x/da/MISA5.jpg']"
0,V-Neck Sheath Dress,A V-neck and front slit bring the perfect balance to this simply sleek LBD by Alexia Admor.,"Black scuba (95% Polyester, 5% Spandex). Sheath. Sleeveless. V-neckline. Back zipper closure. Fully lined. 41"" from shoulder to hemline. Imported.",Alexia Admor,200,USD,"{'3': 0, '5': 0, 'purchase': 0}","[{'id': 0, 'options': {'sizes': 'Sized: XS-XL'}, 'images': ['https://pc-ap.rtrcdn.com/productimages/nomodel/183x/42/AAD44.jpg', 'https://pc-ap.rtrcdn.com/productimages/front/183x/42/AAD44.jpg', 'https://pc-ap.rtrcdn.com/productimages/back/183x/42/AAD44.jpg', 'https://pc-ap.rtrcdn.com/productimages/side/183x/42/AAD44.jpg'], 'inStock': True}]",[{'size': 'Sized: XS-XL'}],"['https://pc-ap.rtrcdn.com/productimages/nomodel/183x/42/AAD44.jpg', 'https://pc-ap.rtrcdn.com/productimages/front/183x/42/AAD44.jpg', 'https://pc-ap.rtrcdn.com/productimages/back/183x/42/AAD44.jpg', 'https://pc-ap.rtrcdn.com/productimages/side/183x/42/AAD44.jpg']"
0,Champagne Peppermint Dress,"Romantic ruffle edges the plunging neckline of this twirl-worthy Reformation dress that's a total evening stunner.

Also available in Blush.","Cream crepe (100% Viscose). Maxi. Wrap. Sleeveless. V-neckline. Fully lined. 46"" from shoulder to hemline. Imported.",Reformation,388,USD,"{'3': 0, '5': 0, 'purchase': 0}","[{'id': 0, 'options': {'sizes': 'Sized: XS-XL, one length available.'}, 'images': ['https://pc-ap.rtrcdn.com/productimages/nomodel/183x/51/REF17.jpg', 'https://pc-ap.rtrcdn.com/productimages/front/183x/51/REF17.jpg', 'https://pc-ap.rtrcdn.com/productimages/back/183x/51/REF17.jpg', 'https://pc-ap.rtrcdn.com/productimages/side/183x/51/REF17.jpg'], 'inStock': True}]","[{'size': 'Sized: XS-XL, one length available.'}]","['https://pc-ap.rtrcdn.com/productimages/nomodel/183x/51/REF17.jpg', 'https://pc-ap.rtrcdn.com/productimages/front/183x/51/REF17.jpg', 'https://pc-ap.rtrcdn.com/productimages/back/183x/51/REF17.jpg', 'https://pc-ap.rtrcdn.com/productimages/side/183x/51/REF17.jpg']"
0,Wine Devin Lace Dress,Strike a romantic note in this Saylor lace sheath dress. Style with the Jeweled Heart Earrings by Oscar de la Renta.,"Red floral lace (70% Cotton, 30% Nylon). Sheath. Long sleeves. High neckline with keyhole. Hidden back zipper closure. Partially lined. 33.5"" from shoulder to hemline. Imported.",Saylor,264,USD,"{'3': 0, '5': 0, 'purchase': 0}","[{'id': 0, 'options': {'sizes': 'Sized: XS-XXL'}, 'images': ['https://pc-ap.rtrcdn.com/productimages/nomodel/183x/21/SLR67.jpg', 'https://pc-ap.rtrcdn.com/productimages/front/183x/21/SLR67.jpg', 'https://pc-ap.rtrcdn.com/productimages/back/183x/21/SLR67.jpg', 'https://pc-ap.rtrcdn.com/productimages/side/183x/21/SLR67.jpg'], 'inStock': True}]",[{'size': 'Sized: XS-XXL'}],"['https://pc-ap.rtrcdn.com/productimages/nomodel/183x/21/SLR67.jpg', 'https://pc-ap.rtrcdn.com/productimages/front/183x/21/SLR67.jpg', 'https://pc-ap.rtrcdn.com/productimages/back/183x/21/SLR67.jpg', 'https://pc-ap.rtrcdn.com/productimages/side/183x/21/SLR67.jpg']"
0,Sierra Frill Dress,Geometric embroidery adds chic structure to the flirty flared silhouette of this playful BARDOT dress.,"Black & white cotton (100% Cotton). Hourglass. Sleeveless. V-neckline. Hidden back zipper closure. Fully lined. 35"" from shoulder to hemline. Imported.",BARDOT,159,USD,"{'3': 0, '5': 0, 'purchase': 0}","[{'id': 0, 'options': {'sizes': 'Sized: XS-L'}, 'images': ['https://pc-ap.rtrcdn.com/productimages/nomodel/183x/db/BDT5.jpg', 'https://pc-ap.rtrcdn.com/productimages/front/183x/db/BDT5.jpg', 'https://pc-ap.rtrcdn.com/productimages/back/183x/db/BDT5.jpg', 'https://pc-ap.rtrcdn.com/productimages/side/183x/db/BDT5.jpg'], 'inStock': True}]",[{'size': 'Sized: XS-L'}],"['https://pc-ap.rtrcdn.com/productimages/nomodel/183x/db/BDT5.jpg', 'https://pc-ap.rtrcdn.com/productimages/front/183x/db/BDT5.jpg', 'https://pc-ap.rtrcdn.com/productimages/back/183x/db/BDT5.jpg', 'https://pc-ap.rtrcdn.com/productimages/side/183x/db/BDT5.jpg']"
0,Blue Delilah Maxi,Give off some serious Mediterranean vibes with this Amanda Uprichard maxi. A faded print and ruffled bodice create an airy style that's perfect for garden parties. Pull your hair back and show off those shoulders.,Blue printed crepe (100% Polyester). Short sleeves. Off the shoulder neckline. Maxi. Fully lined. See size and fit tab for length. Made in USA.,Amanda Uprichard,305,USD,"{'3': 0, '5': 0, 'purchase': 0}","[{'id': 0, 'options': {'sizes': 'This dress runs true to size. We recommend going one size up for backup (see following fit notes for exceptions). Sized: XS-L.'}, 'images': ['https://pc-ap.rtrcdn.com/productimages/nomodel/183x/fa/AMU53.jpg', 'https://pc-ap.rtrcdn.com/productimages/front/183x/fa/AMU53.jpg', 'https://pc-ap.rtrcdn.com/productimages/back/183x/fa/AMU53.jpg', 'https://pc-ap.rtrcdn.com/productimages/side/183x/fa/AMU53.jpg'], 'inStock': True}]",[{'size': 'This dress runs true to size. We recommend going one size up for backup (see following fit notes for exceptions). Sized: XS-L.'}],"['https://pc-ap.rtrcdn.com/productimages/nomodel/183x/fa/AMU53.jpg', 'https://pc-ap.rtrcdn.com/productimages/front/183x/fa/AMU53.jpg', 'https://pc-ap.rtrcdn.com/productimages/back/183x/fa/AMU53.jpg', 'https://pc-ap.rtrcdn.com/productimages/side/183x/fa/AMU53.jpg']"
0,Black Swept Away Maxi,"Flaunting a painterly floral motif, this feminine wrap-front maxi dress by Yumi Kim features a deep V-neck, slim tie waist and elegantly flowing skirt.

Also available in Blue.",Black floral printed silk crepe (100% Silk). Maxi with wrap detail. Cap sleeves. V-neckline. Partially lined. See size and fit tab for lengths. Imported.,Yumi Kim,298,USD,"{'3': 0, '5': 0, 'purchase': 0}","[{'id': 0, 'options': {'sizes': ""Sized: XS-XL, one length available. Regular measures 58'' from shoulder to hemline.""}, 'images': ['https://pc-ap.rtrcdn.com/productimages/nomodel/183x/11/YK50.jpg', 'https://pc-ap.rtrcdn.com/productimages/front/183x/11/YK50.jpg', 'https://pc-ap.rtrcdn.com/productimages/back/183x/11/YK50.jpg', 'https://pc-ap.rtrcdn.com/productimages/side/183x/11/YK50.jpg'], 'inStock': True}]","[{'size': ""Sized: XS-XL, one length available. Regular measures 58'' from shoulder to hemline.""}]","['https://pc-ap.rtrcdn.com/productimages/nomodel/183x/11/YK50.jpg', 'https://pc-ap.rtrcdn.com/productimages/front/183x/11/YK50.jpg', 'https://pc-ap.rtrcdn.com/productimages/back/183x/11/YK50.jpg', 'https://pc-ap.rtrcdn.com/productimages/side/183x/11/YK50.jpg']"
0,Inge Sheath,Intricate embroidery makes a regal statement on this elongating CATHERINE DEANE sheath dress.,"Turquoise heavy jersey (100% Cotton). Sheath. Cap sleeves. Crew neckline. Hidden back zipper closure. Fully lined. 39.5"" from shoulder to hemline. Imported.",CATHERINE DEANE,395,USD,"{'3': 0, '5': 0, 'purchase': 0}","[{'id': 0, 'options': {'sizes': 'Sized: 0-16'}, 'images': ['https://pc-ap.rtrcdn.com/productimages/nomodel/183x/4e/CD43.jpg', 'https://pc-ap.rtrcdn.com/productimages/front/183x/4e/CD43.jpg', 'https://pc-ap.rtrcdn.com/productimages/back/183x/4e/CD43.jpg', 'https://pc-ap.rtrcdn.com/productimages/front_plus/183x/4e/CD43.jpg'], 'inStock': True}]",[{'size': 'Sized: 0-16'}],"['https://pc-ap.rtrcdn.com/productimages/nomodel/183x/4e/CD43.jpg', 'https://pc-ap.rtrcdn.com/productimages/front/183x/4e/CD43.jpg', 'https://pc-ap.rtrcdn.com/productimages/back/183x/4e/CD43.jpg', 'https://pc-ap.rtrcdn.com/productimages/front_plus/183x/4e/CD43.jpg']"
0,Leopard Ruffle Hem Dress,Get ready to pounce on this flirty Slate & Willow dress decorated in leopard spots of flocked velvet.,"Black animal printed (95% Polyester, 5% Spandex). Sheath with ruffle hem. Cap sleeves. 34"" from shoulder to hemline. Back zipper closure. Made in the USA.",Slate & Willow,118,USD,"{'3': 0, '5': 0, 'purchase': 0}","[{'id': 0, 'options': {'sizes': 'Sized: XS-L'}, 'images': ['https://pc-ap.rtrcdn.com/productimages/nomodel/183x/68/SW603.jpg', 'https://pc-ap.rtrcdn.com/productimages/front/183x/68/SW603.jpg', 'https://pc-ap.rtrcdn.com/productimages/back/183x/68/SW603.jpg', 'https://pc-ap.rtrcdn.com/productimages/side/183x/68/SW603.jpg'], 'inStock': True}]",[{'size': 'Sized: XS-L'}],"['https://pc-ap.rtrcdn.com/productimages/nomodel/183x/68/SW603.jpg', 'https://pc-ap.rtrcdn.com/productimages/front/183x/68/SW603.jpg', 'https://pc-ap.rtrcdn.com/productimages/back/183x/68/SW603.jpg', 'https://pc-ap.rtrcdn.com/productimages/side/183x/68/SW603.jpg']"
0,Light Blue Monte Dress,This CYNTHIA STEFFE dress is fresh and floral. Try wearing it with wedges.,Blue and floral printed crepe (100% Polyester). Sleeveless. Halter neckline. Lined. 37” from shoulder to hemline. Imported.,CYNTHIA STEFFE,228,USD,"{'3': 0, '5': 0, 'purchase': 0}","[{'id': 0, 'options': {'sizes': 'This dress runs true to size. We recommend going one size down for backup (see following fit notes for exceptions). Sized: 0-12.'}, 'images': ['https://pc-ap.rtrcdn.com/productimages/nomodel/183x/6d/CY14.jpg', 'https://pc-ap.rtrcdn.com/productimages/front/183x/6d/CY14.jpg', 'https://pc-ap.rtrcdn.com/productimages/back/183x/6d/CY14.jpg', 'https://pc-ap.rtrcdn.com/productimages/side/183x/6d/CY14.jpg'], 'inStock': True}]",[{'size': 'This dress runs true to size. We recommend going one size down for backup (see following fit notes for exceptions). Sized: 0-12.'}],"['https://pc-ap.rtrcdn.com/productimages/nomodel/183x/6d/CY14.jpg', 'https://pc-ap.rtrcdn.com/productimages/front/183x/6d/CY14.jpg', 'https://pc-ap.rtrcdn.com/productimages/back/183x/6d/CY14.jpg', 'https://pc-ap.rtrcdn.com/productimages/side/183x/6d/CY14.jpg']"
0,Printed Lace Sweetheart Midi Dress,"Contrasting types of lace. A dainty printed underlay. A feminine sweetheart neckline. A delicate scalloped hemline. This Free People dress is a major romantic, boho statement.","Cream lace (100% Polyester knit). Sleeveless. Sweetheart neckline. Sheath bodice. Hidden side zipper. Partially lined. 47"" from shoulder to hem. Imported.",Free People,198,USD,"{'3': 0, '5': 0, 'purchase': 0}","[{'id': 0, 'options': {'sizes': 'This dress runs true to size. We recommend going one size up for backup (see following fit notes for exceptions). Sized: 0-12.'}, 'images': ['https://pc-ap.rtrcdn.com/productimages/nomodel/183x/a4/FP58.jpg', 'https://pc-ap.rtrcdn.com/productimages/front/183x/a4/FP58.jpg', 'https://pc-ap.rtrcdn.com/productimages/back/183x/a4/FP58.jpg', 'https://pc-ap.rtrcdn.com/productimages/side/183x/a4/FP58.jpg'], 'inStock': True}]",[{'size': 'This dress runs true to size. We recommend going one size up for backup (see following fit notes for exceptions). Sized: 0-12.'}],"['https://pc-ap.rtrcdn.com/productimages/nomodel/183x/a4/FP58.jpg', 'https://pc-ap.rtrcdn.com/productimages/front/183x/a4/FP58.jpg', 'https://pc-ap.rtrcdn.com/productimages/back/183x/a4/FP58.jpg', 'https://pc-ap.rtrcdn.com/productimages/side/183x/a4/FP58.jpg']"
0,Fly Trap Dress,A pretty garden's worth of flowers brings ladylike charm to this fluid dress by Bailey 44.,"White floral printed crepe (100% Polyester). Hourglass. Sleeveless. V-neckline. Hidden back zipper with hook-and-eye closure. Fully lined. 46"" from shoulder to hemline. Imported.",Bailey 44,218,USD,"{'3': 0, '5': 0, 'purchase': 0}","[{'id': 0, 'options': {'sizes': 'This dress runs true to size. We recommend going one size up for backup (see following fit notes for exceptions).'}, 'images': ['https://pc-ap.rtrcdn.com/productimages/nomodel/183x/34/BL84.jpg', 'https://pc-ap.rtrcdn.com/productimages/front/183x/34/BL84.jpg', 'https://pc-ap.rtrcdn.com/productimages/back/183x/34/BL84.jpg', 'https://pc-ap.rtrcdn.com/productimages/side/183x/34/BL84.jpg'], 'inStock': True}]",[{'size': 'This dress runs true to size. We recommend going one size up for backup (see following fit notes for exceptions).'}],"['https://pc-ap.rtrcdn.com/productimages/nomodel/183x/34/BL84.jpg', 'https://pc-ap.rtrcdn.com/productimages/front/183x/34/BL84.jpg', 'https://pc-ap.rtrcdn.com/productimages/back/183x/34/BL84.jpg', 'https://pc-ap.rtrcdn.com/productimages/side/183x/34/BL84.jpg']"
0,Red One Shoulder Popover Dress,"Bold structure. A bodycon design that hugs every curve. A one-shoulder design. A flattering popover waist. This ELLIATT dress is the epitome of sophistication. We love it with a sleek bun and a simple nude heel.

Also available in Black.",Red crepe (100% Polyester). Short sleeves. One shoulder neckline. Sheath. Hidden side zipper. Partially lined. 38” from shoulder to hemline. Imported.,ELLIATT,208,USD,"{'3': 0, '5': 0, 'purchase': 0}","[{'id': 0, 'options': {'sizes': 'This dress runs true to size. We recommend going one size up for backup (see following fit notes for exceptions).'}, 'images': ['https://pc-ap.rtrcdn.com/productimages/nomodel/183x/df/ELT23.jpg', 'https://pc-ap.rtrcdn.com/productimages/front/183x/df/ELT23.jpg', 'https://pc-ap.rtrcdn.com/productimages/back/183x/df/ELT23.jpg', 'https://pc-ap.rtrcdn.com/productimages/side/183x/df/ELT23.jpg'], 'inStock': True}]",[{'size': 'This dress runs true to size. We recommend going one size up for backup (see following fit notes for exceptions).'}],"['https://pc-ap.rtrcdn.com/productimages/nomodel/183x/df/ELT23.jpg', 'https://pc-ap.rtrcdn.com/productimages/front/183x/df/ELT23.jpg', 'https://pc-ap.rtrcdn.com/productimages/back/183x/df/ELT23.jpg', 'https://pc-ap.rtrcdn.com/productimages/side/183x/df/ELT23.jpg']"
0,Red Pleated Tea Dress,"Aflutter with romance, this chic color-blocked dress by Aidan Mattox balances a flouncy popover bodice and swingy pleated skirt.","Red & pink crepe (94% Polyester, 6% Spandex). Hourglass. Strapless. Straight neckline. Hidden back zipper with hook-and-eye closure. Fully lined. 42"" from bust to hemline. Imported.",Aidan Mattox,265,USD,"{'3': 0, '5': 0, 'purchase': 0}","[{'id': 0, 'options': {'sizes': 'Sized: 0-14, one length available. Regular measures 42"" from bust to hemline.'}, 'images': ['https://pc-ap.rtrcdn.com/productimages/nomodel/183x/7c/AID12.jpg', 'https://pc-ap.rtrcdn.com/productimages/front/183x/7c/AID12.jpg', 'https://pc-ap.rtrcdn.com/productimages/back/183x/7c/AID12.jpg', 'https://pc-ap.rtrcdn.com/productimages/side/183x/7c/AID12.jpg'], 'inStock': True}]","[{'size': 'Sized: 0-14, one length available. Regular measures 42"" from bust to hemline.'}]","['https://pc-ap.rtrcdn.com/productimages/nomodel/183x/7c/AID12.jpg', 'https://pc-ap.rtrcdn.com/productimages/front/183x/7c/AID12.jpg', 'https://pc-ap.rtrcdn.com/productimages/back/183x/7c/AID12.jpg', 'https://pc-ap.rtrcdn.com/productimages/side/183x/7c/AID12.jpg']"
0,Red Illusion Sheath,A flattering silhouette. Bold hue. Elegant cutout. This long sleeve dress by Theia is a certified head-turner.,"Red crepe (92% Polyester, 8% Polyurethane). Sheath. Long sleeves. Crew neckline with cut out. Hidden back zipper closure. Fully lined. 40"" from shoulder to hemline. Imported.",Theia,298,USD,"{'3': 0, '5': 0, 'purchase': 0}","[{'id': 0, 'options': {'sizes': 'Sized: 0-12'}, 'images': ['https://pc-ap.rtrcdn.com/productimages/nomodel/183x/a5/TA143.jpg', 'https://pc-ap.rtrcdn.com/productimages/front/183x/a5/TA143.jpg', 'https://pc-ap.rtrcdn.com/productimages/back/183x/a5/TA143.jpg', 'https://pc-ap.rtrcdn.com/productimages/side/183x/a5/TA143.jpg'], 'inStock': True}]",[{'size': 'Sized: 0-12'}],"['https://pc-ap.rtrcdn.com/productimages/nomodel/183x/a5/TA143.jpg', 'https://pc-ap.rtrcdn.com/productimages/front/183x/a5/TA143.jpg', 'https://pc-ap.rtrcdn.com/productimages/back/183x/a5/TA143.jpg', 'https://pc-ap.rtrcdn.com/productimages/side/183x/a5/TA143.jpg']"
0,Sangria Mini Dress,Tonal ladder stitching circles the structured fit-and-flare design of this sweet FINDERS KEEPERS dress. Style with the Flower Double Hoop Earrings by Oscar de la Renta.,"Black crepe (88% Polyester, 12% Elastane). Hourglass. Short sleeves. Crew neckline. Hidden back zipper closure. Partially lined. 33.5"" from shoulder to hemline. Imported.",FINDERS KEEPERS,175,USD,"{'3': 0, '5': 0, 'purchase': 0}","[{'id': 0, 'options': {'sizes': 'This dress runs true to size. We recommend going one size up for backup (see following fit notes for exceptions).'}, 'images': ['https://pc-ap.rtrcdn.com/productimages/nomodel/183x/6d/FK32.jpg', 'https://pc-ap.rtrcdn.com/productimages/front/183x/6d/FK32.jpg', 'https://pc-ap.rtrcdn.com/productimages/back/183x/6d/FK32.jpg', 'https://pc-ap.rtrcdn.com/productimages/side/183x/6d/FK32.jpg'], 'inStock': True}]",[{'size': 'This dress runs true to size. We recommend going one size up for backup (see following fit notes for exceptions).'}],"['https://pc-ap.rtrcdn.com/productimages/nomodel/183x/6d/FK32.jpg', 'https://pc-ap.rtrcdn.com/productimages/front/183x/6d/FK32.jpg', 'https://pc-ap.rtrcdn.com/productimages/back/183x/6d/FK32.jpg', 'https://pc-ap.rtrcdn.com/productimages/side/183x/6d/FK32.jpg']"
0,Floral Knot Shoulder Dress,Knotted shoulder straps heighten the modern appeal of this feminine floral dress by DRAPER JAMES.,"Blue cotton (97% Cotton, 3% Lycra). Hourglass. Sleeveless. V-neckline. Fully lined. Back zipper closure. 37"" from shoulder to hemline. Imported.",Draper James,135,USD,"{'3': 0, '5': 0, 'purchase': 0}","[{'id': 0, 'options': {'sizes': 'Sized: 0-14'}, 'images': ['https://pc-ap.rtrcdn.com/productimages/nomodel/183x/f9/DJ59.jpg', 'https://pc-ap.rtrcdn.com/productimages/front/183x/f9/DJ59.jpg', 'https://pc-ap.rtrcdn.com/productimages/back/183x/f9/DJ59.jpg', 'https://pc-ap.rtrcdn.com/productimages/side/183x/f9/DJ59.jpg'], 'inStock': True}]",[{'size': 'Sized: 0-14'}],"['https://pc-ap.rtrcdn.com/productimages/nomodel/183x/f9/DJ59.jpg', 'https://pc-ap.rtrcdn.com/productimages/front/183x/f9/DJ59.jpg', 'https://pc-ap.rtrcdn.com/productimages/back/183x/f9/DJ59.jpg', 'https://pc-ap.rtrcdn.com/productimages/side/183x/f9/DJ59.jpg']"
0,Floral Ponte A-Line Dress,Dainty bouquets freshen things up on this streamlined A-line dress by DRAPER JAMES.,"Navy rayon (82.5% Rayon, 13.5% Nylon, 4% Spandex). Hourglass. Cap sleeves. Crew neckline. 36"" from shoulder to hemline. Imported.",Draper James,125,USD,"{'3': 0, '5': 0, 'purchase': 0}","[{'id': 0, 'options': {'sizes': 'Sized: XS-XL'}, 'images': ['https://pc-ap.rtrcdn.com/productimages/nomodel/183x/95/DJ64.jpg', 'https://pc-ap.rtrcdn.com/productimages/front/183x/95/DJ64.jpg', 'https://pc-ap.rtrcdn.com/productimages/back/183x/95/DJ64.jpg', 'https://pc-ap.rtrcdn.com/productimages/side/183x/95/DJ64.jpg'], 'inStock': True}]",[{'size': 'Sized: XS-XL'}],"['https://pc-ap.rtrcdn.com/productimages/nomodel/183x/95/DJ64.jpg', 'https://pc-ap.rtrcdn.com/productimages/front/183x/95/DJ64.jpg', 'https://pc-ap.rtrcdn.com/productimages/back/183x/95/DJ64.jpg', 'https://pc-ap.rtrcdn.com/productimages/side/183x/95/DJ64.jpg']"
0,Sequin Kyle Sheath,Layered sequins and a mermaid skirt enhance the appeal of this curve-hugging dress by Dress The Population.,"Black crepe (97% Polyester, 3% Spandex). Sheath. Sleeveless. V-neckline. Hidden back zipper closure. Fully lined. 47"" from shoulder to hemline. Imported.",Dress The Population,288,USD,"{'3': 0, '5': 0, 'purchase': 0}","[{'id': 0, 'options': {'sizes': 'Sized: XS-XXL, one length available. Regular measures 47"" from shoulder to hemline.'}, 'images': ['https://pc-ap.rtrcdn.com/productimages/nomodel/183x/5b/DTP43.jpg', 'https://pc-ap.rtrcdn.com/productimages/front/183x/5b/DTP43.jpg', 'https://pc-ap.rtrcdn.com/productimages/back/183x/5b/DTP43.jpg', 'https://pc-ap.rtrcdn.com/productimages/side/183x/5b/DTP43.jpg'], 'inStock': True}]","[{'size': 'Sized: XS-XXL, one length available. Regular measures 47"" from shoulder to hemline.'}]","['https://pc-ap.rtrcdn.com/productimages/nomodel/183x/5b/DTP43.jpg', 'https://pc-ap.rtrcdn.com/productimages/front/183x/5b/DTP43.jpg', 'https://pc-ap.rtrcdn.com/productimages/back/183x/5b/DTP43.jpg', 'https://pc-ap.rtrcdn.com/productimages/side/183x/5b/DTP43.jpg']"
0,Deannie Gown,"Backed with an ethereal overlay for graceful flutter, this one-shoulder gown by Lauren Ralph Lauren is equally elegant and enchanting.","Blue crepe (95% Polyester, 5% Elastane). Gown. Short sleeves. One shoulder neckline.Elastic waistband. Fully lined. See size and fit tab for length; 18"" Slit. Imported.",Lauren Ralph Lauren,210,USD,"{'3': 0, '5': 0, 'purchase': 0}","[{'id': 0, 'options': {'sizes': 'Sized: 0-18, one length available. Regular measures 58"" from shoulder to hemline.'}, 'images': ['https://pc-ap.rtrcdn.com/productimages/nomodel/183x/bd/LRL34.jpg', 'https://pc-ap.rtrcdn.com/productimages/front/183x/bd/LRL34.jpg', 'https://pc-ap.rtrcdn.com/productimages/back/183x/bd/LRL34.jpg', 'https://pc-ap.rtrcdn.com/productimages/front_plus/183x/bd/LRL34.jpg'], 'inStock': True}]","[{'size': 'Sized: 0-18, one length available. Regular measures 58"" from shoulder to hemline.'}]","['https://pc-ap.rtrcdn.com/productimages/nomodel/183x/bd/LRL34.jpg', 'https://pc-ap.rtrcdn.com/productimages/front/183x/bd/LRL34.jpg', 'https://pc-ap.rtrcdn.com/productimages/back/183x/bd/LRL34.jpg', 'https://pc-ap.rtrcdn.com/productimages/front_plus/183x/bd/LRL34.jpg']"
0,Navy Midi Flare Dress,"Sweet as it is soft, this extra-comfy Slate & Willow fit-and-flare is elevated with springy pleats. Try it with Alexis Bittar's Watery Stone Chandelier Clip Earrings.","Navy scuba (95% Polyester, 5% Spandex). Full Skirt. Sleeveless. V-neck. Back zipper closure. Lined. Pockets. 43"" from shoulder to hemline. Made in the USA.",Slate & Willow,168,USD,"{'3': 0, '5': 0, 'purchase': 0}","[{'id': 0, 'options': {'sizes': 'Sized: XS-L, one length available. Regular measures 43"" from shoulder to hemline.'}, 'images': ['https://pc-ap.rtrcdn.com/productimages/nomodel/183x/b8/SW637.jpg', 'https://pc-ap.rtrcdn.com/productimages/front/183x/b8/SW637.jpg', 'https://pc-ap.rtrcdn.com/productimages/back/183x/b8/SW637.jpg', 'https://pc-ap.rtrcdn.com/productimages/side/183x/b8/SW637.jpg'], 'inStock': True}]","[{'size': 'Sized: XS-L, one length available. Regular measures 43"" from shoulder to hemline.'}]","['https://pc-ap.rtrcdn.com/productimages/nomodel/183x/b8/SW637.jpg', 'https://pc-ap.rtrcdn.com/productimages/front/183x/b8/SW637.jpg', 'https://pc-ap.rtrcdn.com/productimages/back/183x/b8/SW637.jpg', 'https://pc-ap.rtrcdn.com/productimages/side/183x/b8/SW637.jpg']"
