sku,title,description,details,designer,mrsp,currencyId,prices,variants,optionTypes,defaultImages
0,Plum Lace Aurora Dress,"Texture floral lace adds allure to this Dress The Population sheath that's RSVP ready. We love to style with Sachin & Babi's Heart Hoop Earrings to complete the look.

Also available in Green and Pink.","Purple & navy two toned crochet lace (100% Polyester). Sheath. Sleeveless. Scoop neckline. Hidden back zipper closure. Partially lined. 45"" from shoulder to hemline. Imported.",Dress The Population,242,USD,"{'3': 0, '5': 0, 'purchase': 0}","[{'id': 0, 'options': {'sizes': 'This dress runs true to size. We recommend going one size up for backup (see following fit notes for exceptions).'}, 'images': ['https://pc-ap.rtrcdn.com/productimages/nomodel/183x/aa/DTP41.jpg', 'https://pc-ap.rtrcdn.com/productimages/front/183x/aa/DTP41.jpg', 'https://pc-ap.rtrcdn.com/productimages/back/183x/aa/DTP41.jpg', 'https://pc-ap.rtrcdn.com/productimages/side/183x/aa/DTP41.jpg'], 'inStock': True}]",[{'size': 'This dress runs true to size. We recommend going one size up for backup (see following fit notes for exceptions).'}],"['https://pc-ap.rtrcdn.com/productimages/nomodel/183x/aa/DTP41.jpg', 'https://pc-ap.rtrcdn.com/productimages/front/183x/aa/DTP41.jpg', 'https://pc-ap.rtrcdn.com/productimages/back/183x/aa/DTP41.jpg', 'https://pc-ap.rtrcdn.com/productimages/side/183x/aa/DTP41.jpg']"
0,Navy Nala Shift,"A floral-embroidered yoke decorates the minimal, carefree silhouette of this Lilly Pulitzer shift dress.

Also available in Pink.","Navy crepe (100% Polyester). Shift. Sleeveless. Crew neckline. Back zipper closure. 36"" from shoulder to hemline. Imported.",Lilly Pulitzer,178,USD,"{'3': 0, '5': 0, 'purchase': 0}","[{'id': 0, 'options': {'sizes': 'Sized: 0-16'}, 'images': ['https://pc-ap.rtrcdn.com/productimages/nomodel/183x/8d/LP119.jpg', 'https://pc-ap.rtrcdn.com/productimages/front/183x/8d/LP119.jpg', 'https://pc-ap.rtrcdn.com/productimages/back/183x/8d/LP119.jpg', 'https://pc-ap.rtrcdn.com/productimages/side/183x/8d/LP119.jpg'], 'inStock': True}]",[{'size': 'Sized: 0-16'}],"['https://pc-ap.rtrcdn.com/productimages/nomodel/183x/8d/LP119.jpg', 'https://pc-ap.rtrcdn.com/productimages/front/183x/8d/LP119.jpg', 'https://pc-ap.rtrcdn.com/productimages/back/183x/8d/LP119.jpg', 'https://pc-ap.rtrcdn.com/productimages/side/183x/8d/LP119.jpg']"
0,Remy Maxi,"This timeless wrap dress by HEARTLOOM makes getting dressed (snd looking good) easy, all that's missing are a few accessories.","Rose jersey (73% Modal, 27% Polyester). Maxi. Short sleeves. V-neckline. Wrap closure. See size and fit tab for length. Imported.",HEARTLOOM,124,USD,"{'3': 0, '5': 0, 'purchase': 0}","[{'id': 0, 'options': {'sizes': 'Sized: XS-L, two lengths available. Regular measures 58"" from shoulder to hemline.'}, 'images': ['https://pc-ap.rtrcdn.com/productimages/nomodel/183x/1d/HRTL6.jpg', 'https://pc-ap.rtrcdn.com/productimages/front/183x/1d/HRTL6.jpg', 'https://pc-ap.rtrcdn.com/productimages/back/183x/1d/HRTL6.jpg', 'https://pc-ap.rtrcdn.com/productimages/side/183x/1d/HRTL6.jpg'], 'inStock': True}]","[{'size': 'Sized: XS-L, two lengths available. Regular measures 58"" from shoulder to hemline.'}]","['https://pc-ap.rtrcdn.com/productimages/nomodel/183x/1d/HRTL6.jpg', 'https://pc-ap.rtrcdn.com/productimages/front/183x/1d/HRTL6.jpg', 'https://pc-ap.rtrcdn.com/productimages/back/183x/1d/HRTL6.jpg', 'https://pc-ap.rtrcdn.com/productimages/side/183x/1d/HRTL6.jpg']"
0,Lace Simone Mini Dress,Intricate lace turns heads on this sweet Saylor dress styled with a ruffled sash and sparkly stripes. Try it with Oscar de la Renta's Bold Crystal Earrings.,"Black lace (100% Polyester). Sheath. Long sleeves. Mock neckline. Exposed back zipper closure. Partially lined. 33.5"" from shoulder to hemline. Imported.",Saylor,275,USD,"{'3': 0, '5': 0, 'purchase': 0}","[{'id': 0, 'options': {'sizes': 'Sized: XS-L'}, 'images': ['https://pc-ap.rtrcdn.com/productimages/nomodel/183x/72/SLR65.jpg', 'https://pc-ap.rtrcdn.com/productimages/front/183x/72/SLR65.jpg', 'https://pc-ap.rtrcdn.com/productimages/back/183x/72/SLR65.jpg', 'https://pc-ap.rtrcdn.com/productimages/side/183x/72/SLR65.jpg'], 'inStock': True}]",[{'size': 'Sized: XS-L'}],"['https://pc-ap.rtrcdn.com/productimages/nomodel/183x/72/SLR65.jpg', 'https://pc-ap.rtrcdn.com/productimages/front/183x/72/SLR65.jpg', 'https://pc-ap.rtrcdn.com/productimages/back/183x/72/SLR65.jpg', 'https://pc-ap.rtrcdn.com/productimages/side/183x/72/SLR65.jpg']"
0,Structured Cold Shoulder Dress,"Sophisticated and sweet, this Nicole Miller sheath dress showcases flirty cutouts. Complete the look with the Foil Minaudiere Sondra Roberts.","Black jersey (64% Viscose, 28% Nylon, 8% Spandex). Sheath. Short sleeves. Sweetheart neckline. Hidden back zipper closure. 37.5"" from shoulder to hemline. Imported.",Nicole Miller,395,USD,"{'3': 0, '5': 0, 'purchase': 0}","[{'id': 0, 'options': {'sizes': 'This dress runs small. We recommend sizing up (see following fit notes for exceptions).'}, 'images': ['https://pc-ap.rtrcdn.com/productimages/nomodel/183x/72/NM366.jpg', 'https://pc-ap.rtrcdn.com/productimages/front/183x/72/NM366.jpg', 'https://pc-ap.rtrcdn.com/productimages/back/183x/72/NM366.jpg', 'https://pc-ap.rtrcdn.com/productimages/side/183x/72/NM366.jpg'], 'inStock': True}]",[{'size': 'This dress runs small. We recommend sizing up (see following fit notes for exceptions).'}],"['https://pc-ap.rtrcdn.com/productimages/nomodel/183x/72/NM366.jpg', 'https://pc-ap.rtrcdn.com/productimages/front/183x/72/NM366.jpg', 'https://pc-ap.rtrcdn.com/productimages/back/183x/72/NM366.jpg', 'https://pc-ap.rtrcdn.com/productimages/side/183x/72/NM366.jpg']"
0,Garden Floral Asymmetrical Dress,"We've found your favorite dress for spring. This eye-catching STYLESTALKER style juxtaposes a vintage-looking floral pattern with a polished, modern asymmetrical silhouette. Pull your hair up to show off the bold look and pair it with a simple nude heel.",White floral printed crepe (100% Polyester). Short sleeves. Crew neckline. Hourglass bodice with asymmetrical skirt. Exposed back zipper. Fully lined. 33.5” from shoulder to shortest hemline and 43” from shoulder to longest hemline. Imported.,STYLESTALKER,198,USD,"{'3': 0, '5': 0, 'purchase': 0}","[{'id': 0, 'options': {'sizes': 'This dress runs true to size. We recommend going one size up for backup (see following fit notes for exceptions). Sized: XS-XL.'}, 'images': ['https://pc-ap.rtrcdn.com/productimages/nomodel/183x/ac/STS30.jpg', 'https://pc-ap.rtrcdn.com/productimages/front/183x/ac/STS30.jpg', 'https://pc-ap.rtrcdn.com/productimages/back/183x/ac/STS30.jpg', 'https://pc-ap.rtrcdn.com/productimages/side/183x/ac/STS30.jpg'], 'inStock': True}]",[{'size': 'This dress runs true to size. We recommend going one size up for backup (see following fit notes for exceptions). Sized: XS-XL.'}],"['https://pc-ap.rtrcdn.com/productimages/nomodel/183x/ac/STS30.jpg', 'https://pc-ap.rtrcdn.com/productimages/front/183x/ac/STS30.jpg', 'https://pc-ap.rtrcdn.com/productimages/back/183x/ac/STS30.jpg', 'https://pc-ap.rtrcdn.com/productimages/side/183x/ac/STS30.jpg']"
0,Lime Drape Front Dress,A mock neck adds contemporary-chic style to this drape-front Halston Heritage dress.,"Lime silky georgette (100% Polyester). Sheath. Sleeveless. High neckline. Hidden back zipper with hook-and-eye closure. Fully lined. 33"" from shoulder to hemline. Imported.",Halston Heritage,295,USD,"{'3': 0, '5': 0, 'purchase': 0}","[{'id': 0, 'options': {'sizes': 'Sized: 0-14'}, 'images': ['https://pc-ap.rtrcdn.com/productimages/nomodel/183x/d0/HA369.jpg', 'https://pc-ap.rtrcdn.com/productimages/front/183x/d0/HA369.jpg', 'https://pc-ap.rtrcdn.com/productimages/back/183x/d0/HA369.jpg', 'https://pc-ap.rtrcdn.com/productimages/side/183x/d0/HA369.jpg'], 'inStock': True}]",[{'size': 'Sized: 0-14'}],"['https://pc-ap.rtrcdn.com/productimages/nomodel/183x/d0/HA369.jpg', 'https://pc-ap.rtrcdn.com/productimages/front/183x/d0/HA369.jpg', 'https://pc-ap.rtrcdn.com/productimages/back/183x/d0/HA369.jpg', 'https://pc-ap.rtrcdn.com/productimages/side/183x/d0/HA369.jpg']"
0,Rosehip Dress,Slim spaghetti straps suspend this swingy Reformation dress that's dance floor ready. Style it with the Night Sky Necklace by Ettika.,"Black crepe (100% Viscose). Hourglass. Square neckline. Sleeveless. Exposed back zipper. 47.75"" from shoulder to hemline. Made in USA.",Reformation,248,USD,"{'3': 0, '5': 0, 'purchase': 0}","[{'id': 0, 'options': {'sizes': 'Sized: 0-12'}, 'images': ['https://pc-ap.rtrcdn.com/productimages/nomodel/183x/70/REF1.jpg', 'https://pc-ap.rtrcdn.com/productimages/front/183x/70/REF1.jpg', 'https://pc-ap.rtrcdn.com/productimages/back/183x/70/REF1.jpg', 'https://pc-ap.rtrcdn.com/productimages/side/183x/70/REF1.jpg'], 'inStock': True}]",[{'size': 'Sized: 0-12'}],"['https://pc-ap.rtrcdn.com/productimages/nomodel/183x/70/REF1.jpg', 'https://pc-ap.rtrcdn.com/productimages/front/183x/70/REF1.jpg', 'https://pc-ap.rtrcdn.com/productimages/back/183x/70/REF1.jpg', 'https://pc-ap.rtrcdn.com/productimages/side/183x/70/REF1.jpg']"
0,Victoria Dress,"Delightfully feminine, this HEMANT & NANDITA dress flaunts playfully puffed sleeves and a flirty flounced hem.","Green and white cotton (93% Cotton, 7% Lycra). Hourglass. Short sleeves. V-neckline. 37"" from shoulder to hemline. Imported.",Hemant & Nandita,330,USD,"{'3': 0, '5': 0, 'purchase': 0}","[{'id': 0, 'options': {'sizes': 'Sized: XS-XL'}, 'images': ['https://pc-ap.rtrcdn.com/productimages/nomodel/183x/f7/HAN5.jpg', 'https://pc-ap.rtrcdn.com/productimages/front/183x/f7/HAN5.jpg', 'https://pc-ap.rtrcdn.com/productimages/back/183x/f7/HAN5.jpg', 'https://pc-ap.rtrcdn.com/productimages/side/183x/f7/HAN5.jpg'], 'inStock': True}]",[{'size': 'Sized: XS-XL'}],"['https://pc-ap.rtrcdn.com/productimages/nomodel/183x/f7/HAN5.jpg', 'https://pc-ap.rtrcdn.com/productimages/front/183x/f7/HAN5.jpg', 'https://pc-ap.rtrcdn.com/productimages/back/183x/f7/HAN5.jpg', 'https://pc-ap.rtrcdn.com/productimages/side/183x/f7/HAN5.jpg']"
0,Blue Metallic Print Dress,"Like two effortless looks in one, this Slate & Willow dress pairs a solid top with a graphic jacquard skirt. We love it worn with the Sondra Roberts Gold Ombre Glitter Minaudiere.","Black and blue jacquard (98% Polyester, 2% Metallic). Hourglass. 3/4 Sleeves. Crew neckline. Back zipper closure. 36"" from shoulder to hemline. Imported.",Slate & Willow,199,USD,"{'3': 0, '5': 0, 'purchase': 0}","[{'id': 0, 'options': {'sizes': 'Sized: 0-14'}, 'images': ['https://pc-ap.rtrcdn.com/productimages/nomodel/183x/09/SW630.jpg', 'https://pc-ap.rtrcdn.com/productimages/front/183x/09/SW630.jpg', 'https://pc-ap.rtrcdn.com/productimages/back/183x/09/SW630.jpg', 'https://pc-ap.rtrcdn.com/productimages/side/183x/09/SW630.jpg'], 'inStock': True}]",[{'size': 'Sized: 0-14'}],"['https://pc-ap.rtrcdn.com/productimages/nomodel/183x/09/SW630.jpg', 'https://pc-ap.rtrcdn.com/productimages/front/183x/09/SW630.jpg', 'https://pc-ap.rtrcdn.com/productimages/back/183x/09/SW630.jpg', 'https://pc-ap.rtrcdn.com/productimages/side/183x/09/SW630.jpg']"
0,Tara Sheath,A beautifully draped overlay brings of-the-moment style to this one-shoulder sheath dress by Hutch. All that's missing? Colorful accessories.,"White ponte (100% Polyester). Sheath. Short sleeve. One shoulder neckline. Hidden back zipper with hook-and-eye closure. Fully lined. 37"" from shoulder to hemline. Imported.",Hutch,215,USD,"{'3': 0, '5': 0, 'purchase': 0}","[{'id': 0, 'options': {'sizes': 'This dress runs true to size. We recommend going one size up for backup (see following fit notes for exceptions).'}, 'images': ['https://pc-ap.rtrcdn.com/productimages/nomodel/183x/af/HTC28.jpg', 'https://pc-ap.rtrcdn.com/productimages/front/183x/af/HTC28.jpg', 'https://pc-ap.rtrcdn.com/productimages/back/183x/af/HTC28.jpg', 'https://pc-ap.rtrcdn.com/productimages/front_plus/183x/af/HTC28.jpg'], 'inStock': True}]",[{'size': 'This dress runs true to size. We recommend going one size up for backup (see following fit notes for exceptions).'}],"['https://pc-ap.rtrcdn.com/productimages/nomodel/183x/af/HTC28.jpg', 'https://pc-ap.rtrcdn.com/productimages/front/183x/af/HTC28.jpg', 'https://pc-ap.rtrcdn.com/productimages/back/183x/af/HTC28.jpg', 'https://pc-ap.rtrcdn.com/productimages/front_plus/183x/af/HTC28.jpg']"
0,Pink Domino Dress,"Knotted at the waist and draped just right, this sleek MISA Los Angeles dress is effortless.

Also available in Blue.","Magenta chiffon (96% Polyester, 4% Spandex). Sheath. Sleeveless. V-neckline. 37"" from shoulder to hemline. Imported.",MISA Los Angeles,180,USD,"{'3': 0, '5': 0, 'purchase': 0}","[{'id': 0, 'options': {'sizes': 'Sized: XS-XL'}, 'images': ['https://pc-ap.rtrcdn.com/productimages/nomodel/183x/b0/MISA3.jpg', 'https://pc-ap.rtrcdn.com/productimages/front/183x/b0/MISA3.jpg', 'https://pc-ap.rtrcdn.com/productimages/back/183x/b0/MISA3.jpg', 'https://pc-ap.rtrcdn.com/productimages/side/183x/b0/MISA3.jpg'], 'inStock': True}]",[{'size': 'Sized: XS-XL'}],"['https://pc-ap.rtrcdn.com/productimages/nomodel/183x/b0/MISA3.jpg', 'https://pc-ap.rtrcdn.com/productimages/front/183x/b0/MISA3.jpg', 'https://pc-ap.rtrcdn.com/productimages/back/183x/b0/MISA3.jpg', 'https://pc-ap.rtrcdn.com/productimages/side/183x/b0/MISA3.jpg']"
0,Rory Dress,This painterly Lilly Pulitzer dress styled with sweet flutter sleeves will go wherever the wind blows you. Try it with the Blue Robinson Chain Wallet by Tory Burch.c,"Pink and blue satin (100% Polyester). Hourglass. Sleeveless. Crew neckline. Back zipper closure. 40"" from shoulder to hemline. Imported.",Lilly Pulitzer,178,USD,"{'3': 0, '5': 0, 'purchase': 0}","[{'id': 0, 'options': {'sizes': 'Sized: 0-16'}, 'images': ['https://pc-ap.rtrcdn.com/productimages/nomodel/183x/c8/LP116.jpg', 'https://pc-ap.rtrcdn.com/productimages/front/183x/c8/LP116.jpg', 'https://pc-ap.rtrcdn.com/productimages/back/183x/c8/LP116.jpg', 'https://pc-ap.rtrcdn.com/productimages/side/183x/c8/LP116.jpg'], 'inStock': True}]",[{'size': 'Sized: 0-16'}],"['https://pc-ap.rtrcdn.com/productimages/nomodel/183x/c8/LP116.jpg', 'https://pc-ap.rtrcdn.com/productimages/front/183x/c8/LP116.jpg', 'https://pc-ap.rtrcdn.com/productimages/back/183x/c8/LP116.jpg', 'https://pc-ap.rtrcdn.com/productimages/side/183x/c8/LP116.jpg']"
0,Marc Dress,This racerback midi dress by A.L.C. hugs your figure in all the right places and pairs with sneakers or heels just as easily.,"Green cotton (100% Cotton). Sheath. Sleeveless. Hater neckline. 47.5"" from shoulder to hemline. Imported.",A.L.C.,265,USD,"{'3': 0, '5': 0, 'purchase': 0}","[{'id': 0, 'options': {'sizes': 'Sized: XS-XL, one length available. Regular measures 47.5"" from shoulder to hemline.'}, 'images': ['https://pc-ap.rtrcdn.com/productimages/nomodel/183x/45/ALC106.jpg', 'https://pc-ap.rtrcdn.com/productimages/front/183x/45/ALC106.jpg', 'https://pc-ap.rtrcdn.com/productimages/back/183x/45/ALC106.jpg', 'https://pc-ap.rtrcdn.com/productimages/side/183x/45/ALC106.jpg'], 'inStock': True}]","[{'size': 'Sized: XS-XL, one length available. Regular measures 47.5"" from shoulder to hemline.'}]","['https://pc-ap.rtrcdn.com/productimages/nomodel/183x/45/ALC106.jpg', 'https://pc-ap.rtrcdn.com/productimages/front/183x/45/ALC106.jpg', 'https://pc-ap.rtrcdn.com/productimages/back/183x/45/ALC106.jpg', 'https://pc-ap.rtrcdn.com/productimages/side/183x/45/ALC106.jpg']"
0,While Harlow Dress,This white-hot number from Dress The Population makes a sweet statement with its peek-a-boo waist and side pockets.,"White crepe (100% Polyester). Hourglass. Sleeveless. Scoop neckline. Pockets. Hidden back zipper closure. 41.5"" from shoulder to hemline. Imported.",Dress The Population,226,USD,"{'3': 0, '5': 0, 'purchase': 0}","[{'id': 0, 'options': {'sizes': 'Sized: XS-XXL'}, 'images': ['https://pc-ap.rtrcdn.com/productimages/nomodel/183x/90/DTP49.jpg', 'https://pc-ap.rtrcdn.com/productimages/front/183x/90/DTP49.jpg', 'https://pc-ap.rtrcdn.com/productimages/back/183x/90/DTP49.jpg', 'https://pc-ap.rtrcdn.com/productimages/side/183x/90/DTP49.jpg'], 'inStock': True}]",[{'size': 'Sized: XS-XXL'}],"['https://pc-ap.rtrcdn.com/productimages/nomodel/183x/90/DTP49.jpg', 'https://pc-ap.rtrcdn.com/productimages/front/183x/90/DTP49.jpg', 'https://pc-ap.rtrcdn.com/productimages/back/183x/90/DTP49.jpg', 'https://pc-ap.rtrcdn.com/productimages/side/183x/90/DTP49.jpg']"
0,Suki Satin Knot Dress,"Flattering and ready for what have you, this sleek Greylin dress features blouson sleeves and tie detail. Try it with Silver Rectangular Miniaudiere by Halston Heritage Handbags.","Black crepe (100% Polyester). Hourglass. Long sleeves. V-neckline. Hidden side zipper closure. Partially lined. 33.5"" from shoulder to hemline. Imported.",Greylin,142,USD,"{'3': 0, '5': 0, 'purchase': 0}","[{'id': 0, 'options': {'sizes': 'Sized: XS-L'}, 'images': ['https://pc-ap.rtrcdn.com/productimages/nomodel/183x/b3/GRL55.jpg', 'https://pc-ap.rtrcdn.com/productimages/front/183x/b3/GRL55.jpg', 'https://pc-ap.rtrcdn.com/productimages/back/183x/b3/GRL55.jpg', 'https://pc-ap.rtrcdn.com/productimages/side/183x/b3/GRL55.jpg'], 'inStock': True}]",[{'size': 'Sized: XS-L'}],"['https://pc-ap.rtrcdn.com/productimages/nomodel/183x/b3/GRL55.jpg', 'https://pc-ap.rtrcdn.com/productimages/front/183x/b3/GRL55.jpg', 'https://pc-ap.rtrcdn.com/productimages/back/183x/b3/GRL55.jpg', 'https://pc-ap.rtrcdn.com/productimages/side/183x/b3/GRL55.jpg']"
0,Black Ruffle Bell Dress,"With a flippy, flounced hem and complementing flared cuffs, this Jill Jill Stuart LBD offers a little something extra.

Also available in Red and Blue.","Black crepe (92% Polyester, 8% Spandex). Hourglass. Three quarter sleeves. Crew neckline. Hidden back zipper with hook-and-eye closure. 33"" from shoulder to hemline. Imported.",Jill Jill Stuart,288,USD,"{'3': 0, '5': 0, 'purchase': 0}","[{'id': 0, 'options': {'sizes': 'This dress runs true to size. We recommend going one size up for backup (see following fit notes for exceptions).'}, 'images': ['https://pc-ap.rtrcdn.com/productimages/nomodel/183x/ef/JS144.jpg', 'https://pc-ap.rtrcdn.com/productimages/front/183x/ef/JS144.jpg', 'https://pc-ap.rtrcdn.com/productimages/back/183x/ef/JS144.jpg', 'https://pc-ap.rtrcdn.com/productimages/side/183x/ef/JS144.jpg'], 'inStock': True}]",[{'size': 'This dress runs true to size. We recommend going one size up for backup (see following fit notes for exceptions).'}],"['https://pc-ap.rtrcdn.com/productimages/nomodel/183x/ef/JS144.jpg', 'https://pc-ap.rtrcdn.com/productimages/front/183x/ef/JS144.jpg', 'https://pc-ap.rtrcdn.com/productimages/back/183x/ef/JS144.jpg', 'https://pc-ap.rtrcdn.com/productimages/side/183x/ef/JS144.jpg']"
0,Witherspoon Sheath,"Jay Godfrey’s chic sheath features a sultry skin-baring slit. Pair this LBD with pointed toe heels and delicate jewelry.
Also available in red.","Black crepe (98% Polyester, 2% Spandex). Sleeveless. Scoop Neckline. Fitted skirt with front slit. Hidden back zipper with hook-and-eye closure. Fully lined. 37” from shoulder to hemline. Imported.",Jay Godfrey,325,USD,"{'3': 0, '5': 0, 'purchase': 0}","[{'id': 0, 'options': {'sizes': 'Sized: 0-12'}, 'images': ['https://pc-ap.rtrcdn.com/productimages/nomodel/183x/48/JG30.jpg', 'https://pc-ap.rtrcdn.com/productimages/side/183x/48/JG30.jpg', 'https://pc-ap.rtrcdn.com/productimages/back/183x/48/JG30.jpg', 'https://pc-ap.rtrcdn.com/productimages/editorial/183x/48/JG30.jpg'], 'inStock': True}]",[{'size': 'Sized: 0-12'}],"['https://pc-ap.rtrcdn.com/productimages/nomodel/183x/48/JG30.jpg', 'https://pc-ap.rtrcdn.com/productimages/side/183x/48/JG30.jpg', 'https://pc-ap.rtrcdn.com/productimages/back/183x/48/JG30.jpg', 'https://pc-ap.rtrcdn.com/productimages/editorial/183x/48/JG30.jpg']"
0,Black Vana Knit Dress,"The of-the-moment neckline easily transitions into your fall wardrobe with this densely knit STYLESTALKER dress. Pair with the Freesla Moon Earrings by Dannijo.

Also available in Blush.","Black knit (60% Viscose 32% Nylon 8% Elastane). Sheath. Long sleeves. Off the shoulder neckline. 29"" from bust to hemline. Imported.",STYLESTALKER,229,USD,"{'3': 0, '5': 0, 'purchase': 0}","[{'id': 0, 'options': {'sizes': 'Sized: XS-L'}, 'images': ['https://pc-ap.rtrcdn.com/productimages/nomodel/183x/35/STS64.jpg', 'https://pc-ap.rtrcdn.com/productimages/front/183x/35/STS64.jpg', 'https://pc-ap.rtrcdn.com/productimages/back/183x/35/STS64.jpg', 'https://pc-ap.rtrcdn.com/productimages/side/183x/35/STS64.jpg'], 'inStock': True}]",[{'size': 'Sized: XS-L'}],"['https://pc-ap.rtrcdn.com/productimages/nomodel/183x/35/STS64.jpg', 'https://pc-ap.rtrcdn.com/productimages/front/183x/35/STS64.jpg', 'https://pc-ap.rtrcdn.com/productimages/back/183x/35/STS64.jpg', 'https://pc-ap.rtrcdn.com/productimages/side/183x/35/STS64.jpg']"
0,Flowers On The Wall Midi Dress,A textured knit adds allure to this sexy wrap dress from The Jetset Diaries.,"Red knit (65% Viscose, 35% Nylon). Wrap. Sleeveless. V-neckline. Wrap closure. Fully lined. 32"" from shoulder to shortest hemline, 47"" from shoulder to hemline. Imported.",The Jetset Diaries,210,USD,"{'3': 0, '5': 0, 'purchase': 0}","[{'id': 0, 'options': {'sizes': 'Sized: XS-XXL, one length available. Regular measures 32"" from shoulder to shortest hemline, 47"" from shoulder to hemline.'}, 'images': ['https://pc-ap.rtrcdn.com/productimages/nomodel/183x/e3/TJD22.jpg', 'https://pc-ap.rtrcdn.com/productimages/front/183x/e3/TJD22.jpg', 'https://pc-ap.rtrcdn.com/productimages/back/183x/e3/TJD22.jpg', 'https://pc-ap.rtrcdn.com/productimages/side/183x/e3/TJD22.jpg'], 'inStock': True}]","[{'size': 'Sized: XS-XXL, one length available. Regular measures 32"" from shoulder to shortest hemline, 47"" from shoulder to hemline.'}]","['https://pc-ap.rtrcdn.com/productimages/nomodel/183x/e3/TJD22.jpg', 'https://pc-ap.rtrcdn.com/productimages/front/183x/e3/TJD22.jpg', 'https://pc-ap.rtrcdn.com/productimages/back/183x/e3/TJD22.jpg', 'https://pc-ap.rtrcdn.com/productimages/side/183x/e3/TJD22.jpg']"
0,Striped Jazmin Dress,Bright stripes and a dotted eyelet design on this dress by Shoshanna adds a trendy charm to your look.,"White striped cotton (100 % Cotton). Hourglass. Sleeveless with adjustable straps. V-neckline. Partially lined. 44.5"" from shoulder to hemline. Imported.",Shoshanna,395,USD,"{'3': 0, '5': 0, 'purchase': 0}","[{'id': 0, 'options': {'sizes': 'Sized: 0-12'}, 'images': ['https://pc-ap.rtrcdn.com/productimages/nomodel/183x/7a/SH289.jpg', 'https://pc-ap.rtrcdn.com/productimages/front/183x/7a/SH289.jpg', 'https://pc-ap.rtrcdn.com/productimages/back/183x/7a/SH289.jpg', 'https://pc-ap.rtrcdn.com/productimages/side/183x/7a/SH289.jpg'], 'inStock': True}]",[{'size': 'Sized: 0-12'}],"['https://pc-ap.rtrcdn.com/productimages/nomodel/183x/7a/SH289.jpg', 'https://pc-ap.rtrcdn.com/productimages/front/183x/7a/SH289.jpg', 'https://pc-ap.rtrcdn.com/productimages/back/183x/7a/SH289.jpg', 'https://pc-ap.rtrcdn.com/productimages/side/183x/7a/SH289.jpg']"
0,Floral Navy Ruffle Dress,Channel Victorian style in this romantic Slate & Willow dress styled with flocked lace and pert ruffles.,"Navy (97% Polyester, 3% Spandex). Full Skirt. Short sleeves. Crew neck. Back zipper closure. 34"" from shoulder to hemline. Made in the USA.",Slate & Willow,108,USD,"{'3': 0, '5': 0, 'purchase': 0}","[{'id': 0, 'options': {'sizes': 'Sized: XS-L'}, 'images': ['https://pc-ap.rtrcdn.com/productimages/nomodel/183x/63/SW599.jpg', 'https://pc-ap.rtrcdn.com/productimages/front/183x/63/SW599.jpg', 'https://pc-ap.rtrcdn.com/productimages/back/183x/63/SW599.jpg', 'https://pc-ap.rtrcdn.com/productimages/side/183x/63/SW599.jpg'], 'inStock': True}]",[{'size': 'Sized: XS-L'}],"['https://pc-ap.rtrcdn.com/productimages/nomodel/183x/63/SW599.jpg', 'https://pc-ap.rtrcdn.com/productimages/front/183x/63/SW599.jpg', 'https://pc-ap.rtrcdn.com/productimages/back/183x/63/SW599.jpg', 'https://pc-ap.rtrcdn.com/productimages/side/183x/63/SW599.jpg']"
0,Green Lace Aurora Dress,"Equally elegant and alluring in floral lace, this figure-skimming sheath from Dress The Population is ready for all your weekend events.

Also available in Plum and Pink.","Green floral printed lace (100% Polyester). Sheath. Sleeveless. Scoop neckline. Adjustable straps. Hidden back zipper closure. Partially lined. 42"" from bust to hemline. Imported.",Dress The Population,242,USD,"{'3': 0, '5': 0, 'purchase': 0}","[{'id': 0, 'options': {'sizes': 'Sized: XS-XXL, one length available. Regular measures 42"" from bust to hemline.'}, 'images': ['https://pc-ap.rtrcdn.com/productimages/nomodel/183x/3f/DTP29.jpg', 'https://pc-ap.rtrcdn.com/productimages/front/183x/3f/DTP29.jpg', 'https://pc-ap.rtrcdn.com/productimages/back/183x/3f/DTP29.jpg', 'https://pc-ap.rtrcdn.com/productimages/side/183x/3f/DTP29.jpg'], 'inStock': True}]","[{'size': 'Sized: XS-XXL, one length available. Regular measures 42"" from bust to hemline.'}]","['https://pc-ap.rtrcdn.com/productimages/nomodel/183x/3f/DTP29.jpg', 'https://pc-ap.rtrcdn.com/productimages/front/183x/3f/DTP29.jpg', 'https://pc-ap.rtrcdn.com/productimages/back/183x/3f/DTP29.jpg', 'https://pc-ap.rtrcdn.com/productimages/side/183x/3f/DTP29.jpg']"
